{
    "$schema": "./config-schema.json",
    "game_type": "tournament",
    "output_file": "./results.txt",
    "show_visualization": false,
    "game_repetitions": 5,
    "heurstic_simulation_depth": 6,
    "mcts_simulation_count": 300,
    "seed": 666,
    "players": [
        {
            "player_type": "random"
        },
        {
            "player_type": "user"
        }
    ]
}